{
  "$schema": "https://json-schema.org/draft/2020-12/schema",
  "$id": "https://hee3.local/schemas/workflows/procedure-v1.schema.json",
  "title": "HEE3 finite procedure, version 1",
  "description": "A finite, versioned procedure over already-admitted actions. The schema describes a procedure; it grants nothing, schedules nothing, and admits no module. Final acceptance of a parent remains a separate, independent decision.",
  "type": "object",
  "additionalProperties": false,
  "required": [
    "schema",
    "procedure_id",
    "procedure_version",
    "budget",
    "steps",
    "acceptance"
  ],
  "properties": {
    "schema": {
      "type": "string",
      "const": "hee3.workflows.procedure.v1"
    },
    "procedure_id": {
      "type": "string",
      "minLength": 1,
      "maxLength": 128,
      "pattern": "^[a-z0-9][a-z0-9._-]*$",
      "description": "Stable identity of this procedure across revisions."
    },
    "procedure_version": {
      "type": "integer",
      "minimum": 1,
      "description": "Monotonic revision. A composition carries the version it started under; a join against a different version is refused as `stale_procedure_version` rather than silently re-planned."
    },
    "purpose": {
      "type": "string",
      "minLength": 1,
      "maxLength": 4096,
      "description": "What this procedure is for, in the author's words."
    },
    "budget": {
      "$ref": "#/$defs/budget"
    },
    "steps": {
      "type": "array",
      "minItems": 1,
      "maxItems": 64,
      "items": {
        "$ref": "#/$defs/step"
      },
      "description": "At most 64 steps. Finite by construction: there is no loop or expansion form, so the step count is known before anything runs."
    },
    "acceptance": {
      "type": "array",
      "minItems": 1,
      "maxItems": 64,
      "items": {
        "$ref": "#/$defs/criterion"
      },
      "description": "What the parent must show at close. Criteria are stated before the procedure runs, so a failing run cannot be closed by weakening them."
    }
  },
  "$defs": {
    "budget": {
      "type": "object",
      "additionalProperties": false,
      "required": [
        "max_fanout",
        "max_seconds",
        "max_tokens"
      ],
      "properties": {
        "max_fanout": {
          "type": "integer",
          "minimum": 1,
          "maximum": 16,
          "description": "Most steps runnable at once, at most 16. The bound is on the procedure, not on one wave of it."
        },
        "max_seconds": {
          "type": "integer",
          "minimum": 0,
          "maximum": 86400,
          "description": "Wall-clock budget for the whole procedure."
        },
        "max_tokens": {
          "type": "integer",
          "minimum": 0,
          "maximum": 10000000,
          "description": "Usage budget for the whole procedure."
        }
      }
    },
    "step": {
      "type": "object",
      "additionalProperties": false,
      "required": [
        "step_id",
        "action",
        "action_version",
        "retry"
      ],
      "properties": {
        "step_id": {
          "type": "string",
          "minLength": 1,
          "maxLength": 128,
          "pattern": "^[a-z0-9][a-z0-9._-]*$",
          "description": "Stable within the procedure; a composition commits it."
        },
        "action": {
          "type": "string",
          "enum": [
            "tools.list",
            "tools.inspect",
            "task.preview",
            "task.submit",
            "task.get",
            "task.list",
            "task.cancel",
            "task.resolve",
            "thread.get",
            "thread.list",
            "roster.list",
            "roster.inspect",
            "roster.update",
            "roster.disable",
            "service.inspect",
            "service.probe",
            "service.action",
            "analysis.request",
            "analysis.get",
            "events.subscribe",
            "health"
          ],
          "description": "One already-admitted action. The closed enum is the mechanism behind *dynamic text cannot insert unapproved actions*: a name not in the catalogue cannot be spelled here at all."
        },
        "action_version": {
          "type": "integer",
          "minimum": 1
        },
        "depends_on": {
          "type": "array",
          "maxItems": 32,
          "uniqueItems": true,
          "items": {
            "type": "string",
            "minLength": 1,
            "maxLength": 128,
            "pattern": "^[a-z0-9][a-z0-9._-]*$",
            "description": "Another step_id in this procedure."
          },
          "description": "Every entry must name a step present in this procedure; a dangling name is `missing_step`, and a cycle is `cycle`. Neither is representable as a schema constraint, so both are validator obligations listed under `refusals`."
        },
        "required": {
          "type": "boolean",
          "default": true,
          "description": "Whether the join may close without this step's outcome."
        },
        "retry": {
          "type": "object",
          "additionalProperties": false,
          "required": [
            "max_attempts"
          ],
          "properties": {
            "max_attempts": {
              "type": "integer",
              "minimum": 1,
              "maximum": 8,
              "description": "Total attempts, at most 8. A step whose effect could not be observed is never retried by this count: it becomes `effect_unknown` and waits for a reconciliation record."
            },
            "retry_on": {
              "type": "array",
              "uniqueItems": true,
              "maxItems": 8,
              "items": {
                "type": "string",
                "enum": [
                  "unavailable",
                  "deadline_exceeded",
                  "resource_exhausted",
                  "conflict",
                  "internal"
                ]
              },
              "description": "Only these are retryable. `effect_unknown` is deliberately absent: repeating an effect that may already have landed is the harm this bound exists for."
            }
          }
        },
        "notes": {
          "type": "string",
          "minLength": 1,
          "maxLength": 4096,
          "description": "Author's notes. Never read as an instruction or a grant."
        }
      }
    },
    "criterion": {
      "type": "object",
      "additionalProperties": false,
      "required": [
        "criterion_id",
        "statement"
      ],
      "properties": {
        "criterion_id": {
          "type": "string",
          "minLength": 1,
          "maxLength": 128,
          "pattern": "^[a-z0-9][a-z0-9._-]*$",
          "description": "Stable identity of this acceptance criterion."
        },
        "statement": {
          "type": "string",
          "minLength": 1,
          "maxLength": 4096,
          "description": "What must be shown, stated so a reader can check it."
        },
        "evidence": {
          "type": "string",
          "minLength": 1,
          "maxLength": 4096,
          "description": "Where the evidence for it is to be found."
        }
      }
    }
  },
  "hee3": {
    "step_states": [
      "planned",
      "assigned",
      "running",
      "blocked",
      "done",
      "failed",
      "cancelled",
      "effect_unknown"
    ],
    "dispositions": [
      "completion_candidate",
      "repair",
      "blocked"
    ],
    "block_reasons": [
      "missing_child",
      "unmet_acceptance",
      "dissent",
      "stale_version",
      "resource_exhausted",
      "unreconciled_effect"
    ],
    "refusals": [
      "cycle",
      "missing_step",
      "duplicate_step",
      "unknown_action",
      "unsupported_action_version",
      "stale_procedure_version",
      "fanout_exceeded",
      "dependency_limit",
      "retry_limit",
      "time_limit",
      "resource_limit",
      "unreconciled_effect",
      "identity_mismatch"
    ],
    "bounds": {
      "max_steps": 64,
      "max_fanout": 16,
      "max_dependencies": 32,
      "max_retries": 8,
      "max_total_seconds": 86400,
      "max_total_tokens": 10000000
    },
    "action_catalogue": {
      "source": "schemas/actions/control-v1.schema.json",
      "count": 21
    },
    "scope": "Describes a procedure. Starts no scheduler, grants no action, accepts no parent and admits no module."
  }
}
